A1: TIME | B1: DATA(GB) | C1: RATIO | F1: 276.576 | G1: 28.121 | H1: =SUM(F1:G1) -> 304.697
A2: 42890. | B2: 28.121 | C2: 3.9120000000000002e-002 | F2: 392.721 | G2: 43.946 | H2: =SUM(F2:G2) -> 436.667
A3: 42891. | B3: 43.946 | C3: 6.114e-002 | F3: 452.32 | G3: 46.607 | H3: =SUM(F3:G3) -> 498.927
A4: 42892. | B4: 46.607 | C4: 6.4839999999999995e-002 | F4: 1442.82 | G4: 56.047 | H4: =SUM(F4:G4) -> 1498.867
A5: 42893. | B5: 56.047 | C5: 7.7969999999999998e-002 | F5: 1542.079 | G5: 58.289 | H5: =SUM(F5:G5) -> 1600.368
A6: 42894. | B6: 58.289 | C6: 8.1089999999999995e-002 | F6: 1532.785 | G6: 54.05 | H6: =SUM(F6:G6) -> 1586.835
A7: 42895. | B7: 54.05 | C7: 7.5190000000000007e-002 | F7: 765.283 | G7: 39.123 | H7: =SUM(F7:G7) -> 804.406
A8: 42896. | B8: 39.123 | C8: 5.4429999999999999e-002 | F8: 759.156 | G8: 32.94 | H8: =SUM(F8:G8) -> 792.096
A9: 42897. | B9: 32.94 | C9: 4.582e-002 | F9: 1684.579 | G9: 59.916 | H9: =SUM(F9:G9) -> 1744.495
A10: 42898. | B10: 59.916 | C10: 8.3350000000000007e-002 | F10: 1274.406 | G10: 51.247 | H10: =SUM(F10:G10) -> 1325.653
A11: 42899. | B11: 51.247 | C11: 7.1289999999999992e-002 | F11: 1219.522 | G11: 66.364 | H11: =SUM(F11:G11) -> 1285.886
A12: 42900. | B12: 66.364 | C12: 9.2319999999999999e-002 | F12: 1256.718 | G12: 65.931 | H12: =SUM(F12:G12) -> 1322.649
A13: 42901. | B13: 65.931 | C13: 9.172000000000001e-002 | F13: 2448.932 | G13: 75.071 | H13: =SUM(F13:G13) -> 2524.003
A14: 42902. | B14: 75.071 | C14: 0.10443 | F14: 1096.944 | G14: 41.178 | H14: =SUM(F14:G14) -> 1138.122
A15: 42903. | B15: 41.178 | C15: 5.7279999999999998e-002 | H15: =SUM(F15:G15) -> 0