A2: TIME | B2: DATA(GB) | C2: RATIO
A3: 42904. | B3: 26.939 | C3: 6.6920000000000007e-002
A4: 42905. | B4: 31.177 | C4: 7.7450000000000005e-002
A5: 42906. | B5: 29.424 | C5: 7.3099999999999998e-002
A6: 42907. | B6: 29.501 | C6: 7.3289999999999994e-002
A7: 42908. | B7: 28.404 | C7: 7.0559999999999998e-002
A8: 42909. | B8: 31.256 | C8: 7.7649999999999997e-002
A9: 42910. | B9: 28.429 | C9: 7.0620000000000002e-002
A10: 42911. | B10: 25.225 | C10: 6.2659999999999993e-002
A11: 42912. | B11: 29.273 | C11: 7.2720000000000007e-002
A12: 42913. | B12: 28.679 | C12: 7.1239999999999998e-002
A13: 42914. | B13: 28.018 | C13: 6.9599999999999995e-002
A14: 42915. | B14: 30.271 | C14: 7.5199999999999989e-002
A15: 42916. | B15: 30.161 | C15: 7.4929999999999997e-002
A16: 42917. | B16: 25.784 | C16: 6.4049999999999996e-002
A18: 805.963 | B18: 26.939 | C18: =SUM(A18:B18) -> 832.902
A19: 1914.001 | B19: 31.177 | C19: =SUM(A19:B19) -> 1945.178
A20: 1507.732 | B20: 29.424 | C20: =SUM(A20:B20) -> 1537.156
A21: 1210.792 | B21: 29.501 | C21: =SUM(A21:B21) -> 1240.293
A22: 479.496 | B22: 28.404 | C22: =SUM(A22:B22) -> 507.9
A23: 421.431 | B23: 31.256 | C23: =SUM(A23:B23) -> 452.687
A24: 358.983 | B24: 28.429 | C24: =SUM(A24:B24) -> 387.412
A25: 231.621 | B25: 25.225 | C25: =SUM(A25:B25) -> 256.846
A26: 389.652 | B26: 29.273 | C26: =SUM(A26:B26) -> 418.925
A27: 370.672 | B27: 28.679 | C27: =SUM(A27:B27) -> 399.351
A28: 381.241 | B28: 28.018 | C28: =SUM(A28:B28) -> 409.259
A29: 324.157 | B29: 30.271 | C29: =SUM(A29:B29) -> 354.428
A30: 471.209 | B30: 30.161 | C30: =SUM(A30:B30) -> 501.37
A31: 521.769 | B31: 25.784 | C31: =SUM(A31:B31) -> 547.553