A1: TIME | B1: DATA(GB) | C1: RATIO | F1: 147734.63500000001 | G1: 3941.54 | H1: =SUM(F1:G1) -> 151676.175
A2: 42911. | B2: 3941.54 | C2: 7.3130000000000001e-002 | F2: 117142.681 | G2: 4512.683 | H2: =SUM(F2:G2) -> 121655.364
A3: 42912. | B3: 4512.683 | C3: 8.3729999999999999e-002 | F3: 125091.645 | G3: 3636.804 | H3: =SUM(F3:G3) -> 128728.449
A4: 42913. | B4: 3636.804 | C4: 6.7479999999999998e-002 | F4: 132057.617 | G4: 3502.587 | H4: =SUM(F4:G4) -> 135560.204
A5: 42914. | B5: 3502.587 | C5: 6.4989999999999992e-002 | F5: 147135.114 | G5: 3720.366 | H5: =SUM(F5:G5) -> 150855.48
A6: 42915. | B6: 3720.366 | C6: 6.9029999999999994e-002 | F6: 153050.193 | G6: 3906.026 | H6: =SUM(F6:G6) -> 156956.219
A7: 42916. | B7: 3906.026 | C7: 7.2480000000000003e-002 | F7: 163408.24299999999 | G7: 4268.84 | H7: =SUM(F7:G7) -> 167677.083
A8: 42917. | B8: 4268.84 | C8: 7.9210000000000003e-002 | F8: 151759.29800000001 | G8: 3867.872 | H8: =SUM(F8:G8) -> 155627.17
A9: 42918. | B9: 3867.872 | C9: 7.177e-002 | F9: 132968.43700000001 | G9: 4243.069 | H9: =SUM(F9:G9) -> 137211.506
A10: 42919. | B10: 4243.069 | C10: 7.8730000000000008e-002 | F10: 130014.69100000001 | G10: 3611.591 | H10: =SUM(F10:G10) -> 133626.282
A11: 42920. | B11: 3611.591 | C11: 6.701e-002 | F11: 133640.095 | G11: 3524.345 | H11: =SUM(F11:G11) -> 137164.44
A12: 42921. | B12: 3524.345 | C12: 6.5390000000000004e-002 | F12: 145929.24600000001 | G12: 3732.039 | H12: =SUM(F12:G12) -> 149661.285
A13: 42922. | B13: 3732.039 | C13: 6.9249999999999992e-002 | F13: 144913.75399999999 | G13: 4122.101 | H13: =SUM(F13:G13) -> 149035.855
A14: 42923. | B14: 4122.101 | C14: 7.6479999999999992e-002 | F14: 148948.70600000001 | G14: 3304.813 | H14: =SUM(F14:G14) -> 152253.519
A15: 42924. | B15: 3304.813 | C15: 6.132e-002